{
  "schema": 2,
  "event": "start",
  "product": "ferroterm",
  "instance_id": "5f0c6b2e-3d4a-4c8b-9e1f-2a3b4c5d6e7f",
  "version": "1.2.0",
  "git_sha": "1a2b3c4d",
  "licence": "non-commercial",
  "deployment": "compose",
  "uptime_s": 0,
  "cpu_bucket": "3-4",
  "memory_bucket": "8-16",
  "status": {
    "flag_0": true,
    "flag_1": true,
    "flag_2": true,
    "flag_3": true,
    "flag_4": true,
    "flag_5": true,
    "flag_6": true,
    "flag_7": true,
    "flag_8": true,
    "flag_9": true,
    "flag_10": true,
    "flag_11": true,
    "flag_12": true,
    "flag_13": true,
    "flag_14": true,
    "flag_15": true,
    "flag_16": true,
    "flag_17": true,
    "flag_18": true,
    "flag_19": true,
    "flag_20": true,
    "flag_21": true,
    "flag_22": true,
    "flag_23": true,
    "flag_24": true,
    "flag_25": true,
    "flag_26": true,
    "flag_27": true,
    "flag_28": true,
    "flag_29": true,
    "a234567890123456789012345678901b": 10000000,
    "tokens": [
      "a",
      "b",
      "c",
      "d",
      "e",
      "f",
      "g",
      "h",
      "i",
      "j",
      "k",
      "l",
      "m",
      "n",
      "o",
      "p"
    ]
  },
  "first_start": true
}
