{
  "schema": 2,
  "event": "daily",
  "product": "ferroehr",
  "instance_id": "5f0c6b2e-3d4a-4c8b-9e1f-2a3b4c5d6e7f",
  "version": "4.4.0",
  "git_sha": "1a2b3c4d",
  "licence": "non-commercial",
  "deployment": "helm",
  "uptime_s": 86400,
  "cpu_bucket": "3-4",
  "memory_bucket": "8-16",
  "status": {
    "db_ok": true,
    "migrations_ok": true,
    "postgres_major": 18,
    "spec_profile": "stable"
  },
  "metrics": {
    "window_24h": {
      "requests_bucket": "1k-10k",
      "groups": {
        "composition": {
          "p50_ms": 12.5,
          "p95_ms": 80.1,
          "p99_ms": 240.0,
          "errors_5xx": 0,
          "histogram": [
            10,
            40,
            120,
            300,
            90,
            30,
            8,
            2,
            0,
            0,
            0
          ]
        },
        "query": {
          "p50_ms": 30,
          "p95_ms": 310,
          "p99_ms": 900,
          "errors_5xx": 2,
          "histogram": [
            0,
            5,
            40,
            200,
            500,
            300,
            120,
            30,
            4,
            1,
            0
          ]
        },
        "aql": {
          "p50_ms": 60.0,
          "p95_ms": 310.0,
          "p99_ms": 900.0,
          "errors_5xx": 0,
          "histogram": [
            0,
            5,
            40,
            200,
            500,
            300,
            120,
            30,
            4,
            1,
            0
          ]
        }
      },
      "counters": {
        "aql_executions": 1200,
        "aql_slow": 3
      }
    }
  }
}
