{
  "schema": 2,
  "event": "start",
  "product": "ferrofed",
  "instance_id": "5f0c6b2e-3d4a-4c8b-9e1f-2a3b4c5d6e7f",
  "version": "0.5.1",
  "git_sha": "1a2b3c4d",
  "licence": "non-commercial",
  "deployment": "compose",
  "uptime_s": 0,
  "cpu_bucket": "3-4",
  "memory_bucket": "8-16",
  "status": {
    "federation_ok": true,
    "peers": 3
  },
  "first_start": true
}
